artigoEmPeriodico	Carlos Augusto Ferreira de Andrade	2019	1477-0962	http://dx.doi.org/10.1177/0961203319877237	Effectiveness of pharmaceutical care for drug treatment adherence in women with lupus nephritis in Rio de Janeiro, Brazil: a randomized controlled trial	Lupus	OLIVEIRA-SANTOS, M ; VERANI, J F S ; CAMACHO, L A B ; DE ANDRADE, C A F ; KLUMB, E M		
artigoEmPeriodico	Carlos Augusto Ferreira de Andrade	2018	1462-0323	http://dx.doi.org/10.1093/rheumatology/key184	Assessing Qualitatively the Impact of Gout on Sleep: Any Sleep Was a Dream Far Away Until the Gout Flare Resolved	Rheumatology (Oxford. Print)	CARLOS AUGUSTO FERREIRA DE ANDRADE		
artigoEmPeriodico	Carlos Augusto Ferreira de Andrade	2017	1462-0323	http://dx.doi.org/10.1093/rheumatology/kex439	Trying to find an answer for an old question: does Rituximab increase the risk of serious infections in patients with rheumatoid arthritis?	Rheumatology (Oxford. Print)	DE ANDRADE, CARLOS AUGUSTO FERREIRA		
artigoEmPeriodico	Carlos Augusto Ferreira de Andrade	2017	0482-5004	http://dx.doi.org/10.1016/j.rbr.2017.05.004	Recomendações da Sociedade Brasileira de Reumatologia para diagnóstico e tratamento da febre chikungunya. Parte 1 - Diagnóstico e situações especiais	Revista Brasileira De Reumatologia	MARQUES, CLAUDIA DINIZ LOPES DUARTE, ANGELA LUZIA BRANCO PINTO RANZOLIN, ALINE DANTAS, ANDREA TAVARES CAVALCANTI, NARA GUALBERTO GONÇALVES, RAFAELA SILVA GUIMARÃES ROCHA JUNIOR, LAURINDO FERREIRA DA VALADARES, LILIAN DAVID DE AZEVEDO MELO, ANA KARLA GUEDES DE FREIRE, EUTILIA ANDRADE MEDEIROS TEIXEIRA, ROBERTO BEZERRA NETO, FRANCISCO ALVES MEDEIROS, MARTA MARIA DAS CHAGAS CARVALHO, JOZÉLIO FREIRE DE SANTOS, MARIO SERGIO F		
artigoEmPeriodico	Carlos Augusto Ferreira de Andrade	2017	0482-5004	http://dx.doi.org/10.1016/j.rbr.2017.05.005	Recomendações da Sociedade Brasileira de Reumatologia para diagnóstico e tratamento da febre chikungunya. Parte 2 - Tratamento	Revista Brasileira De Reumatologia	MARQUES, CLAUDIA DINIZ LOPES DUARTE, ANGELA LUZIA BRANCO PINTO RANZOLIN, ALINE DANTAS, ANDREA TAVARES CAVALCANTI, NARA GUALBERTO GONÇALVES, RAFAELA SILVA GUIMARÃES JUNIOR, LAURINDO FERREIRA DA ROCHA VALADARES, LILIAN DAVID DE AZEVEDO MELO, ANA KARLA GUEDES DE FREIRE, EUTILIA ANDRADE MEDEIROS TEIXEIRA, ROBERTO NETO, FRANCISCO ALVES BEZERRA MEDEIROS, MARTA MARIA DAS CHAGAS CARVALHO, JOZÉLIO FREIRE DE SANTOS, MARIO SERGIO F		
artigoEmPeriodico	Carlos Augusto Ferreira de Andrade	2016	1745-6215	http://dx.doi.org/10.1186/s13063-016-1317-1	Effectiveness of pharmaceutical care for drug treatment adherence in patients with systemic lupus erythematosus in Rio de Janeiro, Brazil: study protocol for a randomized controlled trial	Trials (London)	OLIVEIRA-SANTOS, M. ; VERANI, J. F. S. ; Camacho, L. A. B. ; ANDRADE, C. A. F. ; FERRANTE-SILVA, R. ; KLUMB, E. M.		
artigoEmPeriodico	Carlos Augusto Ferreira de Andrade	2016	0482-5004	http://dx.doi.org/10.1016/j.rbr.2016.07.008	Infecções graves em pacientes com artrite reumatoide em uso de anakinra, rituximab ou abatacept: revisão sistemática de estudos observacionais	Revista Brasileira de Reumatologia (Impresso)	CABRAL, V. P. ; CARLOS AUGUSTO FERREIRA DE ANDRADE ; Passos, S R L ; Martins, M.M. ; Hockberg, Y H M		
artigoEmPeriodico	Carlos Augusto Ferreira de Andrade	2016	1932-6203		Use of Warning Signs for dengueby pediatric health care staff in Brazil	Plos One	CORREA, L. S. ; HÖKERBERG, Yara Hahr Marques ; OLIVEIRA, R. V. C. ; BARROS, D. M. S. ; ALEXANDRIA, H. A. F. ; DAUMAS, R. P. ; CARLOS AUGUSTO FERREIRA DE ANDRADE ; PASSOS, S.R. ; BRASIL, P.		
artigoEmPeriodico	Carlos Augusto Ferreira de Andrade	2015	1678-4464	http://dx.doi.org/10.1590/0102-311X00123114	Fatores associados ao início tardio da amamentação em hospitais do Sistema Único de Saúde no Município do Rio de Janeiro, Brasil, 2009	Cadernos de Saúde Pública (Online)	Esteves, T. M. B ; DAUMAS, R P ; Oliveira, M. I. C. ; ANDRADE, C. A. F. ; Leite, I C		
artigoEmPeriodico	Carlos Augusto Ferreira de Andrade	2015	1980-8178	http://dx.doi.org/10.5216/rpt.v44i2.36638	EDUCAÇÃO EM SAÚDE NA AMÉRICA DO SUL REFERENTE ÀS LEISHMANIOSES: UMA REVISÃO SISTEMÁTICA	Revista de Patologia Tropical (Online)	SOUZA, C. T. V. ; ANDRADE, C. A. F. ; HORA, D. L. ; HORA, E. L. ; MOMESSO NETO, I. A ; MATOS, M. ; Martins, M. F. M. ; Bedoya Pacheco, S A J		
artigoEmPeriodico	Carlos Augusto Ferreira de Andrade	2014	0034-8910	http://dx.doi.org/10.1590/s0034-8910.2014048005278	Factors associated to breastfeeding in the first hour of life: systematic review	Revista de Saúde Pública (Impresso)	Esteves, T. M. B ; DAUMAS, R P ; ANDRADE, C. A. F. ; Oliveira, M. I. C. ; Leite, I C		
artigoEmPeriodico	Carlos Augusto Ferreira de Andrade	2014	1568-9972	http://dx.doi.org/10.1016/j.autrev.2014.02.003	14th International Congress on Antiphospholipid Antibodies Task Force Report on Obstetric Antiphospholipid Syndrome	Autoimmunity Reviews	JESUS, G. R. ; Agmon-Levin, N ; CARLOS AUGUSTO FERREIRA DE ANDRADE ; Andreoli, L ; CHIGHIZOLA, C. B. ; PORTER, T. F. ; SALMON, J. ; SILVER, R. M. ; Tincani, A ; BRANCH, D. W.		
artigoEmPeriodico	Carlos Augusto Ferreira de Andrade	2014	1516-4446	http://dx.doi.org/10.1590/1516-4446-2013-1219	Suicide risk and alcohol and drug abuse in outpatients with HIV infection and Chagas disease	Revista Brasileira de Psiquiatria (São Paulo. 1999. Impresso)	GUIMARÃES, PATRÍCIA M. ; PASSOS, SONIA R. ; CALVET, GUILHERME A. ; HÖKERBERG, YARA H. ; LESSA, JOSÉ L. ; ANDRADE, CARLOS A. DE		
artigoEmPeriodico	Carlos Augusto Ferreira de Andrade	2014	0482-5004	http://dx.doi.org/10.1016/j.rbr.2014.10.010	Recomendações da Sociedade Brasileira de Reumatologia sobre Diagnóstico e Tratamento das Parasitoses Intestinais em Pacientes com Doenças Reumáticas Autoimunes	Revista Brasileira de Reumatologia (Impresso)	Braz, A S ; ANDRADE, C. F. ; MOTA, L. M. H. ; LIMA, C. M. B. L.		
artigoEmPeriodico	Carlos Augusto Ferreira de Andrade	2014	0899-823X	http://dx.doi.org/10.1017/ice.2014.29	Systematic Review With Meta-Analyses and Critical Appraisal of Clinical Prediction Rules for Pulmonary Tuberculosis in Hospitals	INFECTION CONTROL AND HOSPITAL EPIDEMIOLOGY	GONÇALVES, BERENICE DAS DORES ; LAMBERT PASSOS, SONIA REGINA ; BORGES DOS SANTOS, MARIA ANGELICA ; DE ANDRADE, CARLOS AUGUSTO FERREIRA ; MOREIRA MARTINS, MARIA DE FÁTIMA ; DE QUEIROZ MELLO, FERNANDA CARVALHO		
artigoEmPeriodico	Carlos Augusto Ferreira de Andrade	2013	0482-5004	http://dx.doi.org/10.1590/S0482-50042013000400008	Revisão sistemática da indução de autoanticorpos e lúpus eritematoso pelo infliximabe	Revista Brasileira de Reumatologia (Impresso)	VAZ, J. L. P. ; ANDRADE, C. A. F. ; PEREIRA, A. ; Martins, M. F. M. ; LEVY, R. A.		
artigoEmPeriodico	Carlos Augusto Ferreira de Andrade	2013	0891-3668	http://dx.doi.org/10.1097/inf.0b013e3182868b32	Accuracy And Interobserver Variation Of Three Clinical Decision Rules For The Diagnosis Of Streptococcal Pharyngitis	The Pediatric Infectious Disease Journal	OROFINO, D H G ; Passos, S R L ; ANDRADE, C. A. F. ; HOKERBERG, Y. H. M. ; NIGRI, D. ; Oliveira, R V C		
artigoEmPeriodico	Celia Landmann Szwarcwald	2019	0165-0327	http://dx.doi.org/10.1016/j.jad.2019.03.066	Leisure time physical activity reduces the association between TV-viewing and depressive symptoms: A large study among 59,401 Brazilian adults	JOURNAL OF AFFECTIVE DISORDERS	WERNECK, ANDRÉ O. ; STUBBS, BRENDON ; FERNANDES, RÔMULO A. ; SZWARCWALD, CÉLIA L. ; SILVA, DANILO R.		
artigoEmPeriodico	Celia Landmann Szwarcwald	2019	1980-5497	http://dx.doi.org/10.1590/1980-549720190024	Prevalência e fatores associados da obesidade na população brasileira: estudo com dados aferidos da Pesquisa Nacional de Saúde, 2013	REVISTA BRASILEIRA DE EPIDEMIOLOGIA	FERREIRA, ARTHUR PATE DE SOUZA ; Szwarcwald, Célia Landmann ; DAMACENA, Giseli Nogueira		
artigoEmPeriodico	Celia Landmann Szwarcwald	2019	1472-698X	http://dx.doi.org/10.1186/s12914-019-0193-7	Sex work stigma and non-disclosure to health care providers: data from a large RDS study among FSW in Brazil	BMC International Health and Human Rights	DOURADO, INÊS ; GUIMARÃES, MARK DREW CROSLAND ; DAMACENA, Giseli Nogueira ; MAGNO, LAIO ; DE SOUZA JÚNIOR, PAULO ROBERTO BORGES ; SZWARCWALD, CELIA LANDMANN		
artigoEmPeriodico	Celia Landmann Szwarcwald	2019	0163-8343	http://dx.doi.org/10.1016/j.genhosppsych.2019.07.005	Potential influence of physical, psychological and lifestyle factors on the association between television viewing and depressive symptoms: A cross-sectional study	GENERAL HOSPITAL PSYCHIATRY	WERNECK, ANDRÉ O. ; OYEYEMI, ADEWALE L. ; SZWARCWALD, CÉLIA L. ; STUBBS, BRENDON ; SILVA, DANILO R.		
artigoEmPeriodico	Celia Landmann Szwarcwald	2019	1678-4464	http://dx.doi.org/10.1590/0102-311x00214918	Avaliação das informações do Sistema de Informações sobre Nascidos Vivos (SINASC), Brasil	CADERNOS DE SAÚDE PÚBLICA	Szwarcwald, Célia Landmann; LEAL, Maria Do Carmo ; ESTEVES-PEREIRA, ANA PAULA ; ALMEIDA, Wanessa da Silva de ; FRIAS, Paulo Germano de ; DAMACENA, Giseli Nogueira ; SOUZA JÚNIOR, PAULO ROBERTO BORGES DE ; ROCHA, NARAYANI MARTINS ; MULLACHERY, PRISCILA MELISSA HONORATO		
artigoEmPeriodico	Celia Landmann Szwarcwald	2019	1980-5497	http://dx.doi.org/10.1590/1980-549720190014.supl.2	Utilização de anti-hipertensivos e antidiabéticos no Brasil: análise das diferenças socioeconômicas. Pesquisa Nacional de Saúde 2013	REVISTA BRASILEIRA DE EPIDEMIOLOGIA	MONTEIRO, CAMILA NASCIMENTO ; LIMA, MARGARETH GUIMARÃES ; SZWARCWALD, CELIA LANDMAN ; BASTOS, TÁSSIA FRAGA ; BARROS, MARILISA BERTI DE AZEVEDO		
artigoEmPeriodico	Celia Landmann Szwarcwald	2019	1980-5497	http://dx.doi.org/10.1590/1980-549720190011.supl.2	Desigualdades sociais no perfil de consumo de alimentos da população brasileira: Pesquisa Nacional de Saúde, 2013	REVISTA BRASILEIRA DE EPIDEMIOLOGIA	MEDINA, LHAIS DE PAULA BARBOSA ; BARROS, MARILISA BERTI DE AZEVEDO ; SOUSA, NEUCIANI FERREIRA DA SILVA ; BASTOS, TÁSSIA FRAGA ; LIMA, MARGARETH GUIMARÃES ; SZWARCWALD, CELIA LANDMANN		
artigoEmPeriodico	Celia Landmann Szwarcwald	2019	1980-5497	http://dx.doi.org/10.1590/1980-549720190010.supl.2	Avaliação da função renal na população adulta brasileira, segundo critérios laboratoriais da Pesquisa Nacional de Saúde	REVISTA BRASILEIRA DE EPIDEMIOLOGIA	Malta, Deborah Carvalho ; MACHADO, ÍSIS ELOAH ; PEREIRA, CIMAR AZEREDO ; FIGUEIREDO, ANDRÉ WILLIAN ; AGUIAR, LILIAN KELEN DE ; ALMEIDA, Wanessa da Silva de ; SOUZA, MARIA DE FATIMA MARINHO DE ; ROSENFELD, LUIZ GASTÃO ; SZWARCWALD, CÉLIA LANDMAN		
artigoEmPeriodico	Celia Landmann Szwarcwald	2019	1980-5497	http://dx.doi.org/10.1590/1980-549720190009.supl.2	Estimativa do consumo de sal pela população brasileira: resultado da Pesquisa Nacional de Saúde 2013	REVISTA BRASILEIRA DE EPIDEMIOLOGIA	MILL, JOSÉ GERALDO ; Malta, Deborah Carvalho ; MACHADO, ÍSIS ELOAH ; PATE, ARTHUR ; PEREIRA, CIMAR AZEREDO ; JAIME, PATRÍCIA CONSTANTE ; SZWARCWALD, CÉLIA LANDMAN ; ROSENFELD, LUIZ GASTÃO		
artigoEmPeriodico	Celia Landmann Szwarcwald	2019	1980-5497	http://dx.doi.org/10.1590/1980-549720190006.supl.2	Prevalência de diabetes mellitus determinada pela hemoglobina glicada na população adulta brasileira, Pesquisa Nacional de Saúde	REVISTA BRASILEIRA DE EPIDEMIOLOGIA	Malta, Deborah Carvalho ; DUNCAN, Bruce Bartholow ; SCHMIDT, Maria Inês ; MACHADO, ÍSIS ELOAH ; SILVA, ALANNA GOMES DA ; BERNAL, REGINA TOMIE IVATA ; PEREIRA, CIMAR AZEREDO ; DAMACENA, Giseli Nogueira ; STOPA, SHEILA RIZZATO ; ROSENFELD, LUIZ GASTÃO ; SZWARCWALD, CELIA LANDMAN		
artigoEmPeriodico	Celia Landmann Szwarcwald	2019	1980-5497	http://dx.doi.org/10.1590/1980-549720190005.supl.2	Prevalência de colesterol total e frações alterados na população adulta brasileira: Pesquisa Nacional de Saúde	REVISTA BRASILEIRA DE EPIDEMIOLOGIA	Malta, Deborah Carvalho ; SZWARCWALD, CELIA LANDMAN ; MACHADO, ÍSIS ELOAH ; PEREIRA, CIMAR AZEREDO ; FIGUEIREDO, ANDRÉ WILLIAN ; SÁ, ANA CAROLINA MICHELETTI GOMIDE NOGUEIRA DE ; VELASQUEZ-MELENDEZ, GUSTAVO ; SANTOS, FILIPE MALTA DOS ; SOUZA JUNIOR, PAULO BORGES DE ; STOPA, SHEILA RIZZATO ; ROSENFELD, LUIZ GASTÃO		
artigoEmPeriodico	Celia Landmann Szwarcwald	2019	1980-5497	http://dx.doi.org/10.1590/1980-549720190004.supl.2	Exames laboratoriais da Pesquisa Nacional de Saúde: metodologia de amostragem, coleta e análise dos dados	REVISTA BRASILEIRA DE EPIDEMIOLOGIA	Szwarcwald, Célia Landmann; Malta, Deborah Carvalho ; SOUZA JÚNIOR, PAULO ROBERTO BORGES DE ; ALMEIDA, Wanessa da Silva de ; DAMACENA, Giseli Nogueira ; PEREIRA, CIMAR AZEREDO ; ROSENFELD, LUIZ GASTÃO		
artigoEmPeriodico	Celia Landmann Szwarcwald	2019	1980-5497	http://dx.doi.org/10.1590/1980-549720190003.supl.2	Valores de referência para exames laboratoriais de hemograma da população adulta brasileira: Pesquisa Nacional de Saúde	REVISTA BRASILEIRA DE EPIDEMIOLOGIA	ROSENFELD, LUIZ GASTÃO ; Malta, Deborah Carvalho ; Szwarcwald, Célia Landmann ; BACAL, NYDIA STRACHMAN ; CUDER, MARIA ALICE MARTINS ; PEREIRA, CIMAR AZEREDO ; FIGUEIREDO, ANDRÉ WILLIAM ; SILVA, ALANNA GOMES DA ; MACHADO, ÍSIS ELOAH ; SILVA, WANESSA ALMEIDA DA ; VECINA NETO, GONZALO ; SILVA JÚNIOR, JARBAS BARBOSA DA		
artigoEmPeriodico	Celia Landmann Szwarcwald	2019	1980-5497	http://dx.doi.org/10.1590/1980-549720190002.supl.2	Valores de referência para exames laboratoriais de colesterol, hemoglobina glicosilada e creatinina da população adulta brasileira	REVISTA BRASILEIRA DE EPIDEMIOLOGIA	Szwarcwald, Célia Landmann; Malta, Deborah Carvalho ; PEREIRA, CIMAR AZEREDO ; FIGUEIREDO, ANDRÉ WILLIAM ; ALMEIDA, Wanessa da Silva de ; MACHADO, ISÍS ELOAH ; BACAL, NYDIA STRACHMAN ; SILVA, ALANNA GOMES DA ; SILVA JÚNIOR, JARBAS BARBOSA DA ; ROSENFELD, LUIZ GASTÃO		
artigoEmPeriodico	Celia Landmann Szwarcwald	2019	1980-5497	http://dx.doi.org/10.1590/1980-549720190001.supl.2	Primeiros resultados da análise do laboratório da Pesquisa Nacional de Saúde	REVISTA BRASILEIRA DE EPIDEMIOLOGIA	Malta, Deborah Carvalho ; SZWARCWALD, CÉLIA LANDMAN ; SILVA JÚNIOR, JARBAS BARBOSA DA		
artigoEmPeriodico	Celia Landmann Szwarcwald	2019	1980-5497	http://dx.doi.org/10.1590/1980-549720190009.supl.1	A portrait of risk behavior towards HIV infection among Brazilian Army conscripts by geographic regions, 2016	REVISTA BRASILEIRA DE EPIDEMIOLOGIA	DAMACENA, Giseli Nogueira ; Szwarcwald, Célia Landmann ; MOTTA, LEONARDO RAPONE DA ; KATO, SÉRGIO KAKUTA ; ADAMI, ALINE DE GREGORI ; PAGANELLA, MACHLINE PAIM ; PEREIRA, GERSON FERNANDO MENDES ; SPERHACKE, ROSA DEA		
artigoEmPeriodico	Celia Landmann Szwarcwald	2019	1980-5497	http://dx.doi.org/10.1590/1980-549720190006.supl.1	HIV testing coverage among female sex workers, Brazil, 2016	REVISTA BRASILEIRA DE EPIDEMIOLOGIA	BRITO, ANA MARIA DE ; Szwarcwald, Célia Landmann ; DAMACENA, Giseli Nogueira ; DOURADO, INÊS COSTA		
artigoEmPeriodico	Celia Landmann Szwarcwald	2019	1980-5497	http://dx.doi.org/10.1590/1980-549720190002.supl.1	Application of the Respondent-Driven Sampling methodology in a biological and behavioral surveillance survey among female sex workers, Brazil, 2016	REVISTA BRASILEIRA DE EPIDEMIOLOGIA	DAMACENA, Giseli Nogueira ; Szwarcwald, Célia Landmann ; SOUZA JÚNIOR, PAULO ROBERTO BORGES DE ; FERREIRA JÚNIOR, ORLANDO DA COSTA ; ALMEIDA, Wanessa da Silva de ; PASCOM, Ana Roberta Pati ; PIMENTA, MARIA CRISTINA		
artigoEmPeriodico	Celia Landmann Szwarcwald	2018	1543-3080	http://dx.doi.org/10.1123/jpah.2017-0317	TV Viewing in 60,202 Adults From the National Brazilian Health Survey: Prevalence, Correlates, and Associations With Chronic Diseases	Journal of Physical Activity & Health	WERNECK, ANDRÉ O. ; CYRINO, EDILSON S. ; COLLINGS, PAUL J. ; RONQUE, ENIO R.V. ; SZWARCWALD, CÉLIA L. ; SARDINHA, LUÍS B. ; SILVA, DANILO R.		
artigoEmPeriodico	Celia Landmann Szwarcwald	2018	0165-0327	http://dx.doi.org/10.1016/j.jad.2018.04.083	Associations between TV viewing and depressive symptoms among 60,202 Brazilian adults: The Brazilian national health survey	JOURNAL OF AFFECTIVE DISORDERS	WERNECK, ANDRÉ O. ; OYEYEMI, ADEWALE L. ; SZWARCWALD, CÉLIA L. ; VANCAMPFORT, DAVY ; SILVA, DANILO R.		
artigoEmPeriodico	Celia Landmann Szwarcwald	2018	0301-4460	http://dx.doi.org/10.1080/03014460.2018.1470670	Age at menarche and cancer risk at adulthood	ANNALS OF HUMAN BIOLOGY	WERNECK, ANDRÉ O. ; COELHO-E-SILVA, MANUEL J. ; PADILHA, CAMILA S. ; RONQUE, ENIO R. V. ; CYRINO, EDILSON S. ; SZWARCWALD, CÉLIA L. ; SILVA, DANILO R.		
artigoEmPeriodico	Celia Landmann Szwarcwald	2018	1524-6175	http://dx.doi.org/10.1111/jch.13292	Does leisure-time physical activity attenuate or eliminate the positive association between obesity and high blood pressure?	Journal of Clinical Hypertension	WERNECK, ANDRÉ O ; OYEYEMI, ADEWALE L ; GERAGE, ALINE M ; CYRINO, EDILSON S ; SZWARCWALD, CÉLIA L ; SARDINHA, LUÍS B ; SILVA, DANILO R		
artigoEmPeriodico	Celia Landmann Szwarcwald	2018	0025-7974	http://dx.doi.org/10.1097/MD.0000000000009218	Prevalence estimates of HIV, syphilis, hepatitis B and C among female sex workers (FSW) in Brazil, 2016	MEDICINE	FERREIRA-JÚNIOR, ORLANDO DA COSTA ; GUIMARÃES, MARK DREW CROSLAND ; DAMACENA, Giseli Nogueira ; DE ALMEIDA, WANESSA DA SILVA ; DE SOUZA-JÚNIOR, PAULO ROBERTO BORGES ; Szwarcwald, Célia Landmann		
artigoEmPeriodico	Celia Landmann Szwarcwald	2018	0025-7974	http://dx.doi.org/10.1097/md.0000000000009013	Factors associated with HIV infection among female sex workers in Brazil	MEDICINE	Szwarcwald, Célia Landmann; DAMACENA, Giseli Nogueira ; DE SOUZA-JÚNIOR, PAULO ROBERTO BORGES ; GUIMARÃES, MARK DREW CROSLAND ; DE ALMEIDA, WANESSA DA SILVA ; DE SOUZA FERREIRA, ARTHUR PATE ; FERREIRA-JÚNIOR, ORLANDO DA COSTA ; DOURADO, INÊS		
artigoEmPeriodico	Celia Landmann Szwarcwald	2018	0025-7974	http://dx.doi.org/10.1097/MD.0000000000009227	Changes in attitudes, risky practices, and HIV and syphilis prevalence among female sex workers in Brazil from 2009 to 2016	MEDICINE	Szwarcwald, Célia Landmann; DE ALMEIDA, WANESSA DA SILVA ; DAMACENA, Giseli Nogueira ; DE SOUZA-JÚNIOR, PAULO ROBERTO BORGES ; FERREIRA-JÚNIOR, ORLANDO DA COSTA ; GUIMARÃES, MARK DREW CROSLAND		
artigoEmPeriodico	Celia Landmann Szwarcwald	2018	0916-9636	http://dx.doi.org/10.1038/s41440-018-0079-4	Association between age at menarche and blood pressure in adulthood: is obesity an important mediator?	HYPERTENSION RESEARCH	WERNECK, ANDRÉ O. ; OYEYEMI, ADEWALE L. ; CYRINO, EDILSON S. ; RONQUE, ENIO R. V. ; SZWARCWALD, CÉLIA L. ; COELHO-E-SILVA, MANUEL J. ; SILVA, DANILO R.		
artigoEmPeriodico	Celia Landmann Szwarcwald	2018	0140-6736	http://dx.doi.org/10.1016/s0140-6736(18)31221-2	Burden of disease in Brazil, 1990-2016: a systematic subnational analysis for the Global Burden of Disease Study 2016	LANCET	MARINHO, FATIMA DE AZEREDO PASSOS, VALÉRIA MARIA CARVALHO MALTA, DEBORAH BARBOZA FRANÇA, ELIZABETH ABREU, DAISY M X ARAÚJO, VALDELAINE E M BUSTAMANTE-TEIXEIRA, MARIA TERESA CAMARGOS, PAULO A M DA CUNHA, CAROLINA CÂNDIDA DUNCAN, Bruce Bartholow FELISBINO-MENDES, MARIANA SANTOS GUERRA, MAXIMILIANO RIBEIRO GUIMARAES, MARK D C LOTUFO, PAULO A MARCENES, WAGNER OLIVEIRA, PATRICIA PEREIRA VASCONCELOS DE MOARES PEDROSO, MARCEL RIBEIRO, ANTONIO L SCHMIDT, Maria Inês TEIXEIRA, RENATO AZEREDO VASCONCELOS, ANA MARIA NOGALES BARRETO, MAURICIO L BENSENOR, ISABELA M BRANT, LUISA C C CLARO, RAFAEL M , et al.COSTA PEREIRA, ALEXANDRE COUSIN, EWERTON CURADO, MARIA PAULA DOS SANTOS, KADINE PRISCILA BENDER FARO, ANDRÉ FERRI, CLEUSA P FURTADO, JOÃO M GALL, JULIA GLENN, SCOTT D GOULART, ALESSANDRA CARVALHO ISHITANI, LENICE HARUMI KIELING, CHRISTIAN LADEIRA, ROBERTO MARINI MACHADO, ISIS ELOAH MARTINS, SHEILA CRISTINA OURIQUES MARTINS-MELO, FRANCISCO ROGERLÂNDIO MELO, ANA PAULA SOUTO MILLER-PETRIE, MOLLY K MOONEY, MEGHAN D NUNES, BRUNO P PALONE, MARCOS ROBERTO TOVANI PEREIRA, CLAUDIA C RASELLA, DAVIDE RAY, SARAH E ROEVER, LEONARDO DE FREITAS SALDANHA, RAPHAEL SANTOS, ITAMAR S SCHNEIDER, IONE J C SANTOS SILVA, DIEGO AUGUSTO SILVEIRA, DAYANE GABRIELE ALVES SOARES FILHO, ADAUTO MARTINS MORAES SOUSA, TATIANE CRISTINA SZWARCWALD, CELIA L TRAEBERT, JEFFERSON VELASQUEZ-MELENDEZ, GUSTAVO WANG, YUAN-PANG LOZANO, RAFAEL MURRAY, CHRISTOPHER J L NAGHAVI, MOHSEN ; Burden of disease in Brazil, 1990-2016: a systematic subnational analysis for the Global Burden of Disease Study 2016		
artigoEmPeriodico	Celia Landmann Szwarcwald	2018	1678-4561	http://dx.doi.org/10.1590/1413-81232018236.03942018	Saúde reprodutiva, materna, neonatal e infantil nos 30 anos do Sistema Único de Saúde (SUS)	Ciência & Saúde Coletiva	LEAL, Maria Do Carmo ; SZWARCWALD, CELIA LANDMANN ; ALMEIDA, PAULO VICENTE BONILHA ; AQUINO, ESTELA MARIA LEÃO ; BARRETO, MAURICIO LIMA ; BARROS, FERNANDO ; VICTORA, CESAR		
artigoEmPeriodico	Celia Landmann Szwarcwald	2018	1415-790X	http://dx.doi.org/10.1590/1980-549720180021.supl.1	Prevalência da hipertensão arterial segundo diferentes critérios diagnósticos, Pesquisa Nacional de Saúde	REVISTA BRASILEIRA DE EPIDEMIOLOGIA (IMPRESSO)	Malta, Deborah Carvalho ; GONÇALVES, RENATA PATRÍCIA FONSECA ; MACHADO, ÍSIS ELOAH ; FREITAS, MARIA IMACULADA DE FÁTIMA ; AZEREDO, CIMAR ; SZWARCWALD, CELIA LANDMAN		
artigoEmPeriodico	Celia Landmann Szwarcwald	2018	1741-3842	http://dx.doi.org/10.1093/pubmed/fdy202	Association between physical activity and alcohol consumption: sociodemographic and behavioral patterns in Brazilian adults	JOURNAL OF PUBLIC HEALTH	WERNECK, ANDRÉ O ; OYEYEMI, ADEWALE L ; SZWARCWALD, CÉLIA L ; SILVA, DANILO R		
artigoEmPeriodico	Celia Landmann Szwarcwald	2017	1678-4561	http://dx.doi.org/10.1590/1413-81232017221.16782015	Cobertura de Planos de Saúde na população brasileira, segundo a Pesquisa Nacional de Saúde, 2013	Ciência & Saúde Coletiva (Online)	Malta, Deborah Carvalho ; STOPA, SHEILA RIZZATO ; PEREIRA, CIMAR AZEREDO ; Szwarcwald, Célia Landmann ; OLIVEIRA, MARTHA ; REIS, ARTHUR CHIORO DOS		
artigoEmPeriodico	Celia Landmann Szwarcwald	2017	1678-4561	http://dx.doi.org/10.1590/1413-81232017221.17862015	Acidentes de trabalho autorreferidos pela população adulta brasileira, segundo dados da Pesquisa Nacional de Saúde, 2013	Ciência & Saúde Coletiva (Online)	Malta, Deborah Carvalho ; STOPA, SHEILA RIZZATO ; SILVA, MARTA MARIA ALVES DA ; Szwarcwald, Célia Landmann ; FRANCO, MARCO DA SILVEIRA ; SANTOS, FLAVIA VINHAES ; MACHADO, ELAINE LEANDRO ; GÓMEZ, CARLOS MINAYO		
artigoEmPeriodico	Celia Landmann Szwarcwald	2017	1678-4464	http://dx.doi.org/10.1590/0102-311x00157815	Fatores associados à violência contra mulheres profissionais do sexo de dez cidades brasileiras	CADERNOS DE SAÚDE PÚBLICA	LIMA, FRANCISCA SUELI DA SILVA ; MERCHÁN-HAMANN, EDGAR ; URDANETA, MARGARITA ; DAMACENA, Giseli Nogueira ; Szwarcwald, Célia Landmann		
artigoEmPeriodico	Celia Landmann Szwarcwald	2017	0066-782X	http://dx.doi.org/10.5935/abc.20170055	Self-Reported High-Cholesterol Prevalence in the Brazilian Population: Analysis of the 2013 National Health Survey	Arquivos Brasileiros de Cardiologia	LOTUFO, PAULO A. ; SANTOS, RAUL D. ; SPOSITO, ANDREI C. ; BERTOLAMI, MARCELO ; ROCHA-FARIA NETO, JOSE ; IZAR, M. CRISTINA ; SZWARCWALD, CELIA ; PRADO, ROGÉRIO R. ; STOPPA, SHEILA R. ; MALTA, DEBORAH C. ; BENSENOR, ISABELA M.		
artigoEmPeriodico	Celia Landmann Szwarcwald	2017	0034-8910	http://dx.doi.org/10.1590/s1518-8787.2017051000011	Factors associated with self-reported diabetes according to the 2013 National Health Survey	REVISTA DE SAUDE PUBLICA	Malta, Deborah Carvalho ; BERNAL, REGINA TOMIE IVATA ; ISER, BETINE PINTO MOEHLECKE ; SZWARCWALD, C. L. ; DUNCAN, Bruce Bartholow ; SCHMIDT, Maria Inês		
artigoEmPeriodico	Celia Landmann Szwarcwald	2017	1413-8123	http://dx.doi.org/10.1590/1413-812320172210.12002016	Adequação das informações de mortalidade e correção dos óbitos informados a partir da Pesquisa de Busca Ativa	Ciencia & Saude Coletiva	ALMEIDA, Wanessa da Silva de ; Szwarcwald, Célia Landmann		
artigoEmPeriodico	Celia Landmann Szwarcwald	2017	0954-0121	http://dx.doi.org/10.1080/09540121.2017.1363370	HIV Testing among men in Curitiba, Brazil	AIDS CARE-PSYCHOLOGICAL AND SOCIO-MEDICAL ASPECTS OF AIDS/HIV	SZWARCWALD, CELIA LANDMANN; DAMACENA, Giseli Nogueira ; MIRANDA, RAQUEL LIMA ; PASCOM, Ana Roberta Pati ; JÚNIOR, ARISTIDES BARBOSA		
artigoEmPeriodico	Celia Landmann Szwarcwald	2017	1415-790X	http://dx.doi.org/10.1590/1980-5497201700020002	Captação de óbitos não informados ao Ministério da Saúde: pesquisa de busca ativa de óbitos em municípios brasileiros	REVISTA BRASILEIRA DE EPIDEMIOLOGIA (IMPRESSO)	ALMEIDA, Wanessa da Silva de ; Szwarcwald, Célia Landmann ; FRIAS, PAULO GERMANO DE ; SOUZA JÚNIOR, Paulo Roberto Borges de ; LIMA, RAQUEL BARBOSA DE ; RABELLO NETO, DÁCIO DE LYRA ; ESCALANTE, JUAN JOSÉ CORTEZ		
artigoEmPeriodico	Celia Landmann Szwarcwald	2017	1415-790X	http://dx.doi.org/10.1590/1980-5497201700050005	Principais causas da mortalidade na infância no Brasil, em 1990 e 2015: estimativas do estudo de Carga Global de Doença	REVISTA BRASILEIRA DE EPIDEMIOLOGIA (IMPRESSO)	FRANÇA, ELISABETH BARBOZA ; LANSKY, SÔNIA ; REGO, MARIA ALBERTINA SANTIAGO ; Malta, Deborah Carvalho ; FRANÇA, JULIA SANTIAGO ; TEIXEIRA, RENATO ; PORTO, DENISE ; ALMEIDA, Marcia Furquim de ; SOUZA, MARIA DE FATIMA MARINHO DE ; SZWARCWALD, CÉLIA LANDMAN ; MOONEY, MEGHAN ; NAGHAVI, MOHSEN ; VASCONCELOS, ANA MARIA NOGALES		
artigoEmPeriodico	Celia Landmann Szwarcwald	2017	0034-8910	http://dx.doi.org/10.1590/s1518-8787.2017051000191	Early detection of breast cancer in Brazil: data from the National Health Survey, 2013	REVISTA DE SAUDE PUBLICA	SILVA, GULNAR AZEVEDO E ; SOUZA-JÚNIOR, PAULO ROBERTO BORGES DE ; DAMACENA, Giseli Nogueira ; Szwarcwald, Célia Landmann		
