artigoEmPeriodico	Marilia Sa Carvalho	2014	1935-2735	http://dx.doi.org/10.1371/journal.pntd.0002927	Prospective Study of Leptospirosis Transmission in an Urban Slum Community: Role of Poor Environment in Repeated Exposures to the Leptospira Agent	PLoS Neglected Tropical Diseases (Online)	FELZEMBURGH, RIDALVA D. M. ; RIBEIRO, GUILHERME S. ; COSTA, FEDERICO ; REIS, RENATO B. ; HAGAN, JOSÉ E. ; MELENDEZ, ASTRID X. T. O. ; FRAGA, DEBORAH ; SANTANA, FRANCISCO S. ; MOHR, SHARIF ; DOS SANTOS, BALBINO L. ; SILVA, ADRIANO Q. ; SANTOS, ANDRÉIA C. ; RAVINES, ROMY R. ; TASSINARI, WAGNER S. ; CARVALHO, MARÍLIA S. ; REIS, MITERMAYER G. ; KO, ALBERT I.		
artigoEmPeriodico	Marilia Sa Carvalho	2014	0037-8682	http://dx.doi.org/10.1590/0037-8682-0223-2014	Occurrence of severe dengue in Rio de Janeiro: an ecological study	Revista da Sociedade Brasileira de Medicina Tropical (Impresso)	GIBSON, GERUSA ; SOUZA-SANTOS, REINALDO ; PEDRO, ALEXANDRE SAN ; HONÓRIO, NILDIMAR ALVES ; Sá Carvalho, Marilia		
artigoEmPeriodico	Marilia Sa Carvalho	2014	0102-311X	http://dx.doi.org/10.1590/0102-311xpe010714	Neither better nor worse, simply different	Cadernos de Saúde Pública (ENSP. Impresso)	COELI, C. M. ; PINHEIRO, Rejane Sobrino ; CARVALHO, Marilia Sa		
artigoEmPeriodico	Marilia Sa Carvalho	2014	0102-311X	http://dx.doi.org/10.1590/0102-311XED011214	The value of peer review	Cadernos de Saúde Pública (ENSP. Impresso)	CARVALHO, Marilia Sa; TRAVASSOS, CLAUDIA ; COELI, C. M.		
artigoEmPeriodico	Marilia Sa Carvalho	2014	0102-311X	http://dx.doi.org/10.1590/0102-311xed010214	Collaborative scientific research networks	Cadernos de Saúde Pública (ENSP. Impresso)	Carvalho, Marilia; TRAVASSOS, Cláudia ; COELI, CLAUDIA		
artigoEmPeriodico	Marilia Sa Carvalho	2014	1678-4463		Down with cut	Cadernos de Saúde Pública (Online)	Carvalho, Marília Sá; TRAVASSOS, CLAUDIA ; Coeli, Claudia Medina		
artigoEmPeriodico	Marilia Sa Carvalho	2013	0102-311X	http://dx.doi.org/10.1590/S0102-311X2013000100010	From Primary Care to Hospitalization: Clinical Warning Signs for Severe Dengue Fever in Children and Adolescents During an Outbreak in Rio de Janeiro, Brazil.	Cadernos de Saúde Pública (ENSP. Impresso)	GIBSON, GERUSA ; SOUZA-SANTOS, REINALDO ; BRASIL, PATRÍCIA ; PACHECO, ANTONIO GUILHERME ; CRUZ, OSWALDO G. ; HONÓRIO, NILDIMAR ALVES ; KUBELKA, CLAIRE ; CARVALHO, Marilia Sá		
artigoEmPeriodico	Marilia Sa Carvalho	2013	0102-311X	http://dx.doi.org/10.1590/S0102-311X2013000100001	O caminho dos manuscritos em Cadernos de Saúde Pública	Cadernos de Saúde Pública (ENSP. Impresso)	CARVALHO, Marilia Sa; TRAVASSOS, CLAUDIA ; COELI, C. M. ; Coeli, Cláudia Medina		
artigoEmPeriodico	Marilia Sa Carvalho	2013	0102-311X	http://dx.doi.org/10.1590/S0102-311X2013000200001	Acesso livre	Cadernos de Saúde Pública (ENSP. Impresso)	CARVALHO, Marilia Sá ; TRAVASSOS, CLAUDIA ; Coeli, Cláudia Medina		
artigoEmPeriodico	Marilia Sa Carvalho	2013	1932-6203	http://dx.doi.org/10.1371/journal.pone.0067682	Sustained Reduction of the Dengue Vector Population Resulting from an Integrated Control Strategy Applied in Two Brazilian Cities	Plos One	REGIS, LÊDA N. ; Acioli, Ridelane Veiga ; SILVEIRA, JOSÉ CONSTANTINO ; MELO-SANTOS, MARIA ALICE VARJAL ; SOUZA, WAYNER VIEIRA ; RIBEIRO, CÂNDIDA M. NOGUEIRA. ; DA SILVA, JULIANA C. SERAFIM. ; MONTEIRO, ANTONIO MIGUEL VIEIRA ; OLIVEIRA, CLÁUDIA M. F. ; BARBOSA, ROSÂNGELA M. R. ; BRAGA, CYNTHIA ; RODRIGUES, MARCO AURÉLIO BENEDETTI ; SILVA, MARILÚ GOMES N. M. ; RIBEIRO JR., PAULO JUSTINIANO ; BONAT, WAGNER HUGO ; DE CASTRO MEDEIROS, LILIAM CÉSAR ; CARVALHO, Marilia Sa ; Furtado, André Freire		
artigoEmPeriodico	Marilia Sa Carvalho	2013	0102-311X	http://dx.doi.org/10.1590/s0102-311x2013000400001	Independência editorial	Cadernos de Saúde Pública (ENSP. Impresso)	CARVALHO, Marilia Sá ; TRAVASSOS, CLAUDIA ; Coeli, Cláudia Medina		
artigoEmPeriodico	Marilia Sa Carvalho	2013	0102-311X	http://dx.doi.org/10.1590/S0102-311X2013000700001	Avaliação da produção científica em discussão	Cadernos de Saúde Pública (ENSP. Impresso)	CARVALHO, Marilia Sá ; TRAVASSOS, CLAUDIA ; Coeli, Cláudia Medina		
artigoEmPeriodico	Marilia Sa Carvalho	2013	0028-0836	http://dx.doi.org/10.1038/501492a	Citations: In defence of Brazilian journals	Nature (London)	CARVALHO, Marilia Sá ; TRAVASSOS, CLAUDIA ; Coeli, Claudia Medina		
artigoEmPeriodico	Marilia Sa Carvalho	2013	0102-311X	http://dx.doi.org/10.1590/0102-311XED010913	Um bom texto	Cadernos de Saúde Pública (ENSP. Impresso)	CARVALHO, Marilia Sá ; TRAVASSOS, CLAUDIA ; Coeli, Cláudia Medina		
artigoEmPeriodico	Marilia Sa Carvalho	2013	0091-7435	http://dx.doi.org/10.1016/j.ypmed.2013.08.033	Physical activity-friendly neighbourhood among older adults from a medium size urban setting in Southern Europe	Preventive Medicine (1972. Print)	RIBEIRO, ANA ISABEL ; MITCHELL, RICHARD ; Carvalho, Marília Sá ; DE PINA, MARIA DE FÁTIMA		
artigoEmPeriodico	Marilia Sa Carvalho	2013	0102-311X	http://dx.doi.org/10.1590/s0102-311x2013000800017	Multi-state models for defining degrees of chronicity related to HIV-infected patient therapy adherence	Cadernos de Saúde Pública (ENSP. Impresso)	OLIVEIRA, RAQUEL DE VASCONCELLOS CARVALHAES D ; SHIMAKURA, SILVIA EMIKO ; Campos, Dayse Pereira ; VICTORIANO, FLAVIANA PAVAN ; RIBEIRO, SAYONARA ROCHA ; SANTOS, Valdiléa Gonçalves Veloso dos ; VELOSO, VALDILÉA G. ; Grinsztejn, Beatriz ; CARVALHO, Marilia Sa		
artigoEmPeriodico	Marilia Sa Carvalho	2013	0102-311X	http://dx.doi.org/10.1590/0102-311XED011213	Um ano cor de rosa	Cadernos de Saúde Pública (ENSP. Impresso)	CARVALHO, Marilia Sá ; TRAVASSOS, CLAUDIA ; Coeli, Cláudia Medina		
artigoEmPeriodico	Marilia Sa Carvalho	2013	1020-4989		Determinantes sociais e autorrelato de tuberculose nas regiões metropolitanas conforme a Pesquisa Nacional por Amostra de Domicílios, Brasil	Revista Panamericana de Salud Publica (Print)	Pinheiro, Rejane Sobrino ; Oliveira, Gisele Pinto ; OLIVEIRA, E. X. G. ; Melo, Enirtes Caetano Prates ; Coeli, Cláudia Medina ; CARVALHO, Marilia Sá		
artigoEmPeriodico	Marilia Sa Carvalho	2013	1567-1348	http://dx.doi.org/10.1016/j.meegid.2013.08.017	Single nucleotide polymorphisms in candidate genes and dengue severity in children: A case-control, functional and meta-analysis study	Infection, Genetics and Evolution (Print)	XAVIER-CARVALHO, CAROLINE ; GIBSON, GERUSA ; BRASIL, PATRÍCIA ; FERREIRA, RALPH X. ; DE SOUZA SANTOS, REINALDO ; GONÇALVES CRUZ, OSWALDO ; DE OLIVEIRA, SOLANGE ARTIMOS ; DE SÁ CARVALHO, MARÍLIA ; PACHECO, ANTONIO G. ; KUBELKA, CLAIRE F. ; MORAES, MILTON O.		
artigoEmPeriodico	Marilia Sa Carvalho	2013	0034-8910	http://dx.doi.org/10.1590/s0034-8910.2013047003953	Recrutamento de participantes no Estudo Longitudinal de Saude do Adulto	Revista de Saúde Pública (Impresso)	AQUINO, ESTELA M L ; ARAUJO, MARIA JENNY ; ALMEIDA, MARIA DA CONCEICAO C ; CONCEICAO, PATRICIA ; ANDRADE, CELIA REGINA DE ; CADE, NAGELA VALADAO ; CARVALHO, Marilia Sa ; FIGUEIREDO, ROBERTA CARVALHO DE ; FONSECA, MARIA DE JESUS M DA ; GIATTI, LUANA ; MENEZES, GREICE MARIA DE SOUZA ; NUNES, MARIA ANGELICA ; SOUZA, ANGELITA GOMES DE ; VASCONCELLOS-SILVA, PAULO R ; VIGO, ALVARO		
artigoEmPeriodico	Marilia Sa Carvalho	2013	0034-8910	http://dx.doi.org/10.1590/s0034-8910.2013047003810	Comite de publicacoes em estudo multicentrico e sistema informatizado de apoio - publiELSA	Revista de Saúde Pública (Impresso)	CARVALHO, Marilia Sa; BARRETO, MAURICIO LIMA ; Coeli, Claudia Medina ; RAPOSO, RAFAEL MONTEIRO ; MOTA, EDUARDO LUIZ ANDRADE ; DUNCAN, Bruce Bartholow		
artigoEmPeriodico	Marilia Sa Carvalho	2013	1414-462X	http://dx.doi.org/10.1590/s1414-462x2013000200015	Confiabilidade da informação sobre município de residência no Sistema de Informações Hospitalares - Sistema Único de Saúde para análise do fluxo de pacientes no atendimento do câncer de mama e do colo do útero	Cadernos Saúde Coletiva (UFRJ)	AGUIAR, FERNANDA PINHEIRO ; Melo, Enirtes Caetano Prates ; Oliveira, Evangelina Xavier Gouveia de ; CARVALHO, Marilia Sá ; Pinheiro, Rejane Sobrino		
artigoEmPeriodico	Marilia Sa Carvalho	2013	0102-311X	http://dx.doi.org/10.1590/0102-311xed011113	Mais do mesmo?	Cadernos de Saúde Pública (ENSP. Impresso)	CARVALHO, Marilia Sa; TRAVASSOS, CLAUDIA ; COELI, C. M.		
artigoEmPeriodico	Marilia Sa Carvalho	2013	0277-6715	http://dx.doi.org/10.1002/sim.5549	The development of an early warning system for climate-sensitive disease risk with a focus on dengue epidemics in Southeast Brazil	STATISTICS IN MEDICINE	Lowe, Rachel ; Bailey, Trevor C. ; Stephenson, David B. ; JUPP, TIM E. ; Graham, Richard J. ; BARCELLOS, Christovam ; CARVALHO, Marilia Sá		
artigoEmPeriodico	Marilia Sa Carvalho	2012	0002-9262	http://dx.doi.org/10.1093/aje/kwr294	Brazilian Longitudinal Study of Adult Health (ELSA-Brasil): Objectives and Design	American Journal of Epidemiology	Aquino, E. M. L. ; Barreto, S. M. ; Bensenor, I. M. ; Carvalho, M. S. ; Chor, D. ; Duncan, B. B. ; LOTUFO, P. A. ; MILL, J. G. ; Molina, M. D. C. ; Mota, E. L. A. ; Azeredo Passos, V. M. ; Schmidt, M. I. ; SZKLO, M.		
artigoEmPeriodico	Marilia Sa Carvalho	2012	1548-7660		The RcmdrPlugin.survival Package: Extending the R Commander Interface to Survival Analysis	Journal of Statistical Software	Fox, J. ; Carvalho, Marilia S		
artigoEmPeriodico	Marilia Sa Carvalho	2012	0028-3878	http://dx.doi.org/10.1212/WNL.0b013e31823efc42	Risk factors for lacune subtypes in the Atherosclerosis Risk in Communities (ARIC) Study	Neurology (Cleveland, Ohio)	BEZERRA, D. C. ; SHARRETT, A. R. ; MATSUSHITA, K. ; GOTTESMAN, R. F. ; SHIBATA, D. ; Mosley, T. H. ; CORESH, J. ; SZKLO, M. ; Carvalho, M. S. ; SELVIN, E.		
artigoEmPeriodico	Marilia Sa Carvalho	2012	1414-462X	http://dx.doi.org/10.1590/s1414-462x2012000400018	Explorando os efeitos da recusa de participação na linha de base e ao seguimento sobre a validade em estudos de coorte	Cadernos Saúde Coletiva (UFRJ)	COELI, Claudia Medina ; Carvalho, M. S. ; CHOR, D. ; PINHEIRO, R. S. ; GUIMARAES, P. V. ; SKABA, D.A.		
artigoEmPeriodico	Marilia Sa Carvalho	2012	1471-2458	http://dx.doi.org/10.1186/1471-2458-12-676	Association between self-rated health and mortality: 10 years follow-up to the Pro-Saude cohort study	BMC Public Health (Online)	Nery Guimarães, Joanna Miguez ; CHOR, D. ; Chor, Dóra ; CARVALHO, Marilia Sa ; Werneck, Guilherme Loureiro ; Coeli, Claudia Medina ; LOPES, Claudia S ; FAERSTEIN, Eduardo		
artigoEmPeriodico	Marilia Sa Carvalho	2012	0102-311X	http://dx.doi.org/10.1590/S0102-311X2012001100001	Cadernos de Saúde Pública: uma nova etapa	Cadernos de Saúde Pública (ENSP. Impresso)	CARVALHO, Marilia Sa; TRAVASSOS, CLAUDIA ; COELI, C. M. ; Coeli, Cláudia Medina		
artigoEmPeriodico	Marilia Sa Carvalho	2012	0102-311X	http://dx.doi.org/10.1590/S0102-311X2012001400001	Feliz e criativo 2013 para Cadernos de Saúde Pública	Cadernos de Saúde Pública (ENSP. Impresso)	CARVALHO, Marilia Sa; TRAVASSOS, CLAUDIA ; COELI, C. M. ; Coeli, Cláudia Medina		
trabalhoCompletoEmCongresso	Marilia Sa Carvalho	2012		Determinants of access to mammography in Brazil: what has changed between 2003 and 2008	European Congress of Epidemiology	MELO, Enirtes Caetano Prates de ; OLIVEIRA, Evangelina de ; PINHEIRO, R. S. ; Carvalho, M. S.		
trabalhoCompletoEmCongresso	Marilia Sa Carvalho	2012		Distance to health care and survival of patients who underwent coronary artery bypass grafting and angioplasty	European Congress of Epidemiology	PINHEIRO, R. S. ; AGUIAR, F. P. ; OLIVEIRA, Evangelina de ; MELO, Enirtes Caetano Prates de ; COELI, Claudia Medina ; Carvalho, M. S.		
trabalhoCompletoEmCongresso	Marilia Sa Carvalho	2012		Factors associated with the occurrence of tuberculosis in Brazil: analysis of the 2008 National Household Sample Survey	European Congress of Epidemiology	PINHEIRO, R. S. ; Gisele Oliveira ; OLIVEIRA, Evangelina de ; PRATES, E. C. ; COELI, Claudia Medina ; Carvalho, M. S.		
trabalhoCompletoEmCongresso	Marilia Sa Carvalho	2012		Factors related to health services use in Brazil, 2003?2008	European Congress of Epidemiology	OLIVEIRA, Evangelina de ; MELO, Enirtes Caetano Prates de ; PINHEIRO, R. S. ; Carvalho, M. S.		
trabalhoCompletoEmCongresso	Marilia Sa Carvalho	2012		Social inequalities in the chances of undergoing mammography in Brazil	European Congress of Epidemiology	Chor, Dóra ; OLIVEIRA, Evangelina de ; MELO, Enirtes Caetano Prates de ; PINHEIRO, R. S. ; Carvalho, M. S.		
artigoEmPeriodico	Oswaldo Goncalves Cruz	2019	1473-7159	http://dx.doi.org/10.1080/14737159.2019.1582333	Quantitative real-time PCR for differential diagnostics of parvovirus B19 infection in acute liver failure patients	EXPERT REVIEW OF MOLECULAR DIAGNOSTICS	ALVES, ARTHUR DANIEL ROCHA ; CUBEL GARCIA, RITA DE CASSIA NASSER ; CRUZ, O. G. ; Pinto, M. A. ; AMADO LEON, LUCIANE ALMEIDA		
artigoEmPeriodico	Oswaldo Goncalves Cruz	2019	1020-4989	http://dx.doi.org/10.26633/rpsp.2019.15	Mortalidad atribuible a gripe en los períodos prevacunación y posvacunación en Argentina: estudio ecológico (2002-2016)	REVISTA PANAMERICANA DE SALUD PUBLICA-PAN AMERICAN JOURNAL OF PUBLIC HEALTH	SARROUF, ELENA B. ; SOUZA-SANTOS, REINALDO ; Cruz, Oswaldo Gonçalves		
artigoEmPeriodico	Oswaldo Goncalves Cruz	2019	1678-4464	http://dx.doi.org/10.1590/0102-311x00098918	Acurácia da determinação da idade gestacional no Sistema de Informações sobre Nascidos Vivos (SINASC): um estudo de base populacional	CADERNOS DE SAÚDE PÚBLICA	HENRIQUES, LICIA BARBOSA ; ALVES, ERIKA BARRETO ; VIEIRA, FERNANDA MORENA DOS SANTOS BARBEIRO ; CARDOSO, BRUNO BAPTISTA ; D?ANGELES, ADRIANA CRISTINA RODRIGUES ; Cruz, Oswaldo Gonçalves ; SILVA, MONIQUE FELIX RIBEIRO DA ; SARACENI, VALERIA		
artigoEmPeriodico	Oswaldo Goncalves Cruz	2019	1865-1674	http://dx.doi.org/10.1111/tbed.13210	First description of Theiler's disease-associated virus infection and epidemiological investigation of equine pegivirus and equine hepacivirus coinfection in Brazil	Transboundary and Emerging Diseases	FIGUEIREDO, ANDREZA SORIANO ; MORAES, MARIA VITÓRIA DOS SANTOS ; SOARES, CAROLINE CORDEIRO ; CHALHOUB, FLÁVIA LOWEN LEVY ; FILIPPIS, ANA MARIA BISPO ; SANTOS, DEBORA REGINA LOPES ; ALMEIDA, FERNANDO QUEIROZ ; GODOI, TATIANNE LEME OLIVEIRA SANTOS ; SOUZA, ALINE MOREIRA ; BURDMAN, TATIANA ROZENTAL ; LEMOS, ELBA REGINA SAMPAIO ; REIS, JENNER KARLISSON PIMENTA ; CRUZ, O. G. ; Pinto, M. A.		
artigoEmPeriodico	Oswaldo Goncalves Cruz	2019	1097-0258	http://dx.doi.org/10.1002/sim.8303	A modelling approach for correcting reporting delays in disease surveillance data	Statistics in Medicine	BASTOS, LEONARDO S ; ECONOMOU, THEODOROS ; GOMES, MARCELO F C ; VILLELA, DANIEL A M ; COELHO, FLAVIO C ; CRUZ, OSWALDO G ; STONER, OLIVER ; BAILEY, TREVOR ; CODEÇO, CLAUDIA T		
artigoEmPeriodico	Oswaldo Goncalves Cruz	2019	1471-2954	http://dx.doi.org/10.1098/rspb.2019.1867	Space-time dynamics of a triple epidemic: dengue, chikungunya and Zika clusters in the city of Rio de Janeiro	PROCEEDINGS OF THE ROYAL SOCIETY B: BIOLOGICAL SCIENCES	FREITAS, LAÍS PICININI ; Cruz, Oswaldo Gonçalves ; LOWE, RACHEL ; SÁ CARVALHO, MARILIA		
artigoEmPeriodico	Oswaldo Goncalves Cruz	2018	1567-1348	http://dx.doi.org/10.1016/j.meegid.2018.01.017	Epidemiological investigation and analysis of the NS5B gene and protein variability of non-primate hepacivirus in several horse cohorts in Rio de Janeiro state, Brazil	INFECTION GENETICS AND EVOLUTION	FIGUEIREDO, ANDREZA SORIANO ; LAMPE, ELISABETH ; DE ALBUQUERQUE, PEDRO PEREIRA LIRA FURTADO ; CHALHOUB, FLÁVIA LÖWEN LEVY ; DE FILIPPIS, ANA MARIA BISPO ; VILLAR, LIVIA MELO ; Cruz, Oswaldo Gonçalves ; Pinto, Marcelo Alves ; DE OLIVEIRA, JAQUELINE MENDES		
artigoEmPeriodico	Oswaldo Goncalves Cruz	2018	1660-4601	http://dx.doi.org/10.3390/ijerph15010096	The Zika Virus Epidemic in Brazil: From Discovery to Future Implications	International Journal of Environmental Research and Public Health	LOWE, RACHEL ; BARCELLOS, CHRISTOVAM ; BRASIL, PATRÍCIA ; CRUZ, OSWALDO ; HONÓRIO, NILDIMAR ; KUPER, HANNAH ; CARVALHO, MARILIA		
artigoEmPeriodico	Oswaldo Goncalves Cruz	2018	0398-7620	http://dx.doi.org/10.1016/j.respe.2018.05.408	Infodengue: A nowcasting system for the surveillance of arboviruses in Brazil	REVUE D EPIDEMIOLOGIE ET DE SANTE PUBLIQUE	CODECO, C. ; COELHO, F. ; CRUZ, O. ; OLIVEIRA, S. ; CASTRO, T. ; BASTOS, L.		
artigoEmPeriodico	Oswaldo Goncalves Cruz	2018	0001-706X	http://dx.doi.org/10.1016/j.actatropica.2018.03.006	Time series analysis of dengue surveillance data in two Brazilian cities	ACTA TROPICA	CORTES, FANNY ; TURCHI MARTELLI, CELINA MARIA ; ARRAES DE ALENCAR XIMENES, RICARDO ; MONTARROYOS, ULISSES RAMOS ; SIQUEIRA JUNIOR, JOÃO BOSCO ; GONÇALVES CRUZ, OSWALDO ; ALEXANDER, NEAL ; VIEIRA DE SOUZA, WAYNER		
artigoEmPeriodico	Oswaldo Goncalves Cruz	2017	1932-6203	http://dx.doi.org/10.1371/journal.pone.0174070	Cynomolgus monkeys are successfully and persistently infected with hepatitis E virus genotype 3 (HEV-3) after long-term immunosuppressive therapy	Plos One	GARDINALI, NOEMI ROVARIS ; GUIMARÃES, JULIANA RODRIGUES ; MELGAÇO, JULIANA GIL ; KEVORKIAN, YOHAN BRITTO ; BOTTINO, FERNANDA DE OLIVEIRA ; VIEIRA, YASMINE RANGEL ; DA SILVA, ALINE CAMPOS DE AZEVEDO ; PINTO, DOUGLAS PEREIRA ; DA FONSECA, LAÍS BASTOS ; VILHENA, LEANDRO SCHIAVO ; UIECHI, EDILSON ; DA SILVA, MARIA CRISTINA CARLAN ; MORAN, JULIO ; MARCHEVSKY, Renato Sérgio ; CRUZ, O. G. ; OTONEL, RODRIGO ALEJANDRO ARELLANO ; ALFIERI, AMAURI ALCINDO ; DE OLIVEIRA, JAQUELINE MENDES ; GASPAR, Ana Maria Coimbra ; Pinto, M. A.		
artigoEmPeriodico	Oswaldo Goncalves Cruz	2017	0001-706X	http://dx.doi.org/10.1016/j.actatropica.2017.07.014	Dengue serotype circulation in natural populations of Aedes aegypti	ACTA TROPICA	DOS SANTOS, TAISSA PEREIRA ; CRUZ, OSWALDO GONSALVEZ ; DA SILVA, KELI ANTUNES BARBOSA ; DE CASTRO, MÁRCIA GONÇALVES ; DE BRITO, ANIELLY FERREIRA ; MASPERO, RENATO CESAR ; DE ALCÂNTRA, ROSILENE ; DOS SANTOS, FLÁVIA BARRETO ; HONORIO, NILDIMAR A. ; LOURENÇO-DE-OLIVEIRA, RICARDO		
artigoEmPeriodico	Oswaldo Goncalves Cruz	2017	0950-2688	http://dx.doi.org/10.1017/s0950268817000358	Zika in Rio de Janeiro: Assessment of basic reproduction number and comparison with dengue outbreaks	Epidemiology and Infection (Online)	VILLELA, D. A. M. ; BASTOS, L. S. ; DE CARVALHO, L. M. ; CRUZ, O. G. ; GOMES, M. F. C. ; DUROVNI, B. ; LEMOS, M. C. ; SARACENI, V. ; COELHO, F. C. ; CODEÇO, C. T.		
artigoEmPeriodico	Oswaldo Goncalves Cruz	2017	1475-2875	http://dx.doi.org/10.1186/s12936-017-2045-z	Socioeconomic and demographic characterization of an endemic malaria region in Brazil by multiple correspondence analysis	MALARIA JOURNAL	LANA, RAQUEL M. ; RIBACK, THAIS I. S. ; LIMA, TIAGO F. M. ; DA SILVA-NUNES, MÔNICA ; Cruz, Oswaldo G. ; OLIVEIRA, FRANCISCO G. S. ; MORESCO, GILBERTO G. ; HONÓRIO, NILDIMAR A. ; CODEÇO, CLÁUDIA T.		
artigoEmPeriodico	Oswaldo Goncalves Cruz	2017	1741-3842	http://dx.doi.org/10.1093/pubmed/fdx132	The impact of the Brazilian Family Health Strategy and the conditional cash transfer on tuberculosis treatment outcomes in Rio de Janeiro: an individual-level analysis of secondary data	JOURNAL OF PUBLIC HEALTH	DUROVNI, BETINA ; SARACENI, VALERIA ; PUPPIN, MARIANA SOARES ; TASSINARI, WAGNER ; CRUZ, OSWALDO G ; CAVALCANTE, SOLANGE ; COELI, CLAUDIA MEDINA ; TRAJMAN, ANETE		
artigoEmPeriodico	Oswaldo Goncalves Cruz	2017	0102-311X	http://dx.doi.org/10.1590/0102-311x00005717	Inovações disruptivas e as transformações da saúde pública na era digital	Cadernos de Saude Publica	LEAL NETO, ONICIO BATISTA ; ALBUQUERQUE, JONES ; SOUZA, WAYNER VIEIRA ; CESSE, EDUARDA ; CRUZ, OSWALDO GONÇALVEZ		
artigoEmPeriodico	Oswaldo Goncalves Cruz	2017	0102-311X	http://dx.doi.org/10.1590/0102-311x00164017	Perspectivas otimistas para a saúde do futuro	Cadernos de Saude Publica	LEAL NETO, ONICIO BATISTA ; ALBUQUERQUE, JONES ; CRUZ, OSWALDO GONÇALVEZ ; CESSE, EDUARDA ; SOUZA, WAYNER VIEIRA DE		
artigoEmPeriodico	Oswaldo Goncalves Cruz	2016	1473-3099	http://dx.doi.org/10.1016/S1473-3099(16)30007-X	Epidemiological data accessibility in Brazil	Lancet. Infectious Diseases (Print)	COELHO, FLÁVIO CODEÇO ; CODEÇO, CLÁUDIA TORRES ; Cruz, Oswaldo Gonçalves ; CAMARGO, SABRINA ; BLIMAN, PIERRE-ALEXANDRE		
artigoEmPeriodico	Oswaldo Goncalves Cruz	2016	1678-4464	http://dx.doi.org/10.1590/0102-311X00066215	Eating patterns in the Brazilian Longitudinal Study of Adult Health (ELSA-Brasil): an exploratory analysis	Cadernos de Saúde Pública (Online)	CARDOSO, LETÍCIA DE OLIVEIRA ; CARVALHO, MARILIA SÁ ; Cruz, Oswaldo Gonçalves ; MELERE, CRISTIANE ; LUFT, VIVIAN CRISTINE ; MOLINA, MARIA DEL CARMEN BISI ; FARIA, CAROLINA PERIM DE ; BENSEÑOR, ISABELA M. ; MATOS, SHEILA MARIA ALVIM ; FONSECA, MARIA DE JESUS MENDES DA ; GRIEP, ROSANE HARTER ; CHOR, DÓRA		
artigoEmPeriodico	Oswaldo Goncalves Cruz	2016	1806-3756	http://dx.doi.org/10.1590/S1806-37562015000000069	Factors associated with disease-specific survival of patients with non-small cell lung cancer	Jornal Brasileiro de Pneumologia (Online)	SOUZA, MIRIAN CARVALHO DE ; Cruz, Oswaldo Gonçalves ; VASCONCELOS, ANA GLÓRIA GODOI		
artigoEmPeriodico	Oswaldo Goncalves Cruz	2016	1678-8060	http://dx.doi.org/10.1590/0074-02760160003	Zika is not a reason for missing the Olympic Games in Rio de Janeiro: response to the open letter of Dr Attaran and colleagues to Dr Margaret Chan, Director - General, WHO, on the Zika threat to the Olympic and Paralympic Games	Memórias do Instituto Oswaldo Cruz (Impresso)	CODEÇO, CLAUDIA ; VILLELA, DANIEL ; GOMES, MARCELO F ; BASTOS, LEONARDO ; CRUZ, OSWALDO ; STRUCHINER, CLAUDIO ; CARVALHO, LUIS MAX ; COELHO, FLAVIO		
artigoEmPeriodico	Oswaldo Goncalves Cruz	2016	1948-5182	http://dx.doi.org/10.4254/wjh.v8.i32.1370	Changes in cellular proliferation and plasma products are associated with liver failure	World Journal of Hepatology	MELGAÇO, JULIANA GIL ; Soriani, Frederico Marianetti ; FERREIRA, PEDRO HENRIQUE SUCUPIRA ; PINHEIRO, LEONARDO ASSAF ; VIEIRA, YASMINE RANGEL ; DE OLIVEIRA, JAQUELINE MENDES ; Lewis-Ximenez, Lia Laura ; ARAÚJO, CRISTINA CARVALHO VIANNA ; Pacheco-Moreira, Lúcio Filgueiras ; Menezes, Gustavo Batista ; CRUZ, O. G. ; VITRAL, Claudia Lamarca ; Pinto, M. A.		
artigoEmPeriodico	Oswaldo Goncalves Cruz	2016	1678-4464	http://dx.doi.org/10.1590/0102-311x00175614	Hepatitis A seroprevalence in public school children in Campos dos Goytacazes, Rio de Janeiro State, Brazil, prior to the introduction of the hepatitis A universal childhood vaccination	Cadernos de Saúde Pública (Online)	KURY, CHARBELL MIGUEL ; Pinto, M. A. ; SILVA, JAQUELLINE PEREIRA DA ; CRUZ, O. G. ; VITRAL, Claudia Lamarca		
artigoEmPeriodico	Oswaldo Goncalves Cruz	2015	0001-706X	http://dx.doi.org/10.1016/j.actatropica.2015.04.023	Circulating cytokines and chemokines associated with plasma leakage and hepatic dysfunction in Brazilian children with dengue fever	Acta Tropica	FERREIRA, RALPH ANTONIO XAVIER ; DE OLIVEIRA, SOLANGE ARTIMOS ; Gandini, Mariana ; FERREIRA, LAURA DA CUNHA ; CORREA, GLADYS ; ABIRAUDE, FERNANDA MATTOS ; REID, MARIANA MANCEBO ; Cruz, Oswaldo Gonçalves ; KUBELKA, CLAIRE FERNANDES		
artigoEmPeriodico	Oswaldo Goncalves Cruz	2015	1932-6203	http://dx.doi.org/10.1371/journal.pone.0123826	Parity of Indigenous and Non-Indigenous Women in Brazil: Does the Reported Number of Children Born Depend upon Who Answers National Census Questions?	Plos One	VENTURA SANTOS, RICARDO ; LUIZ BASTOS, JOÃO ; GONÇALVES CRUZ, OSWALDO ; DE BARROS LONGO, LUCIENE APARECIDA FERREIRA ; FLOWERS, NANCY MAY ; DE OLIVEIRA MARTINS PEREIRA, NILZA		
artigoEmPeriodico	Oswaldo Goncalves Cruz	2015	1464-3685	http://dx.doi.org/10.1093/ije/dyv096.484	Patterns of Dietary Intake from the Largest Latin America Epidemiological Cohort Study: Findings from the Brazilian Longitudinal Study of Adult Health (ELSA-Brasil).	International Journal of Epidemiology	CARDOSO, L. ; CARVALHO, M. ; CRUZ, O. D. ; MELERE, C. ; LUFT, V. D. ; MOLINA, M. D. C. ; PERIM, C. D. ; BENSENOR, I. ; ALVIM, S. D. ; FONSECA, M. D. J. D. ; GRIEP, R. H. ; CHOR, D.		
artigoEmPeriodico	Oswaldo Goncalves Cruz	2014	1932-6203	http://dx.doi.org/10.1371/journal.pone.0096314	Sensitivity and Specificity of the World Health Organization Dengue Classification Schemes for Severe Dengue Assessment in Children in Rio de Janeiro	Plos One	MACEDO, GLEICY A. ; GONIN, MICHELLE LUIZA C. ; PONE, SHEILA M. ; Cruz, Oswaldo G. ; NOBRE, FLÁVIO F. ; BRASIL, PATRÍCIA		
artigoEmPeriodico	Oswaldo Goncalves Cruz	2014	2000-8686	http://dx.doi.org/10.3402/iee.v4.22110	Conditions of the household and peridomicile and severe dengue: a case-control study in Brazil	Infection Ecology & Epidemiology	GIBSON, GERUSA ; SOUZA-SANTOS, REINALDO ; ALVES HONÓRIO, NILDIMAR ; GUILHERME PACHECO, ANTONIO ; OZÓRIO MORAES, MILTON ; Kubelka, Claire ; BRASIL, PATRÍCIA ; CRUZ, OSWALDO ; SÁ CARVALHO, MARILIA		
artigoEmPeriodico	Oswaldo Goncalves Cruz	2014	1415-790X	http://dx.doi.org/10.1590/1415-790X201400010014ENG	Profile of patients with lung cancer assisted at the National Cancer Institute, according to their smoking status, from 2000 to 2007	Revista Brasileira de Epidemiologia (Impresso)	SOUZA, MIRIAN CARVALHO DE ; VASCONCELOS, ANA GLÓRIA GODOI ; REBELO, MARISE SOUTO ; REBELO, PAULO ANTONIO DE PAIVA ; Cruz, Oswaldo Gonçalves		
artigoEmPeriodico	Oswaldo Goncalves Cruz	2014	1413-8123	http://dx.doi.org/10.1590/1413-81232014199.06432014	Análise temporal da relação entre leptospirose e ocorrência de inundações por chuvas no município do Rio de Janeiro, Brasil, 2007-2012	Ciência e Saúde Coletiva (Impresso)	GUIMARÃES, RAPHAEL MENDONÇA ; Cruz, Oswaldo Gonçalves ; PARREIRA, VIVIANE GOMES ; MAZOTO, MAÍRA LOPES ; VIEIRA, JULIANA DIAS ; ASMUS, CARMEN ILDES RODRIGUES FRÓES		
